0	0	1582246860738	register	Roger Histand	Roger+Histand@hotmail.com	]=)[X{Km{z
1	13700323	1582260561061	register	Geoffrey Stieff	Geoffrey.Stieff@gmail.com	-']S!{'
2	5867164	1582266428225	register	Wendell Ballan	Wendell-Ballan@gmail.com	6cl_[\
3	3614448	1582270042673	tweet	Roger Histand	QXFzs2tHbuYEELOoSw6VgzieiR2E5iKemOnImqgpdJCGHBtuVK9xKXRUo0oDnurGaDdTQ1MII0xltqNoA3F9l61nbJrgFrkNUydqALgs8wroYRyOr9Son01rnglTiFtZFwHcbMWm2Km62mrLR8QmrAa7KJbrDnBHPIPdfGYLyKMzabUrm5PrpBPgJu6mD7p61f1JLhykOeeLrSAlQFVl8SPRHZp6hGFuwU7mpmYmsGZvhNhIavzknPEuFigWo1MIdzO56wxiue8eT5yBiWZQJca6JtWHcpqmhfnUxro2jBHyRFrv5l4t0TdS0K99LuTvlO8IJWYGfYRQ1XwOhx9JbE5SmiVnTDgB2dFJ0c6F6yHwNqNk4YjLFUKY0wvKb25upg2Jv8pWPYICvJcnofqZPb3UIT4WXguvV5XT4TdyrtAvIpFWHedKMdoCzo1c2ok4eMMKt3KE9cxFd3R90mj8BHwUNIX64D0DCtJ9a6pZ3pwiaInXJURgImwqZeOg1M6ircYswyh6veo4HgfWolJkr8u8a3aUHbhtyiSpQ05JUtTwZhCyraira3rQRESz6h4C0VFu3fYaPxUyHmcsPPSLZDTZm05V5lTafymndftxJJSYPVwRqw7GiuJZUcV0Av4CouEgkdxkfdZlhOCplenbXzV09inwqyjMq4c3C4NZ1pswARxsGkga4allYqkKtOz3ubuVwNVeH1N4QRftrXrTRG7z4PRAkUWdycwDO6C6ijOHAOO53bJjN7xCIq5BcSE5UNj0Bd59kgG40uXFU7d1hxQmc5EGMSotIkWbb89wV6tSlQHAemkLSVXuYoLIaaVEokoVvPsya6Yu4udz7Bc4ouYnbblXp5tr5QOctSSmZZ5l8ycSVu1oqOaPAhpi4qCynXiDF2xjBzcHFjbBZE1ki1EUeQVLcFKJc52xoBCWcbpkCXV3uk5eyf3gTEDgVjLxaUsqwAg5u2pI0To1B8APWqebnR88qPpPMzx50cquL74QNeJQ5ATyKnljm4zbVj2qYuBZ6p7l1ufmnamOZlooLv5sIjAyNfyiTH1IaIjOp2qPvS02jgsfeHbZEirEMTc93qQGDKBSjxUEmCzrYB3zRotOOJ08BCFA12XmDmDk5fvryk2T1N3lEv7sYYAz8Qjkw0QsFmxiSMGYpfDhY5mGuP6g0qkDsDUXMZOVRQwE68O0HBqgGFZH4LI3ZHsRqaw0ky8K5rhN1ap65Wk61uPaSjoE8ggSd5nWzijrRUUo8UiSgImidHIzgGoyGGmEXn9z80yOxS1cpkcydUZt9OGA14jVLT4ZDgl75ip0Q2q4XsskZ01nto28QhMT5TQuMBFIis5YEyJbXlrSrKo2LCCj3pCjvErF7u0w4RRoXHYYk0xnB7yHqbzu9DeD9F15NA5TmT5vig8NIYskTRMcXGkE90AwShj6Isr0XMgcpKv6hcNBUHh5I6yGulOQgs5IaGc4MPWQPtFh12bPF1FiP0e41f52cl1DYeYfMkoYi3HHE7vrz9HUZPx9A0MjYDzouOGlP4vIu50tEhX1XLj2u1mYdV4yqxpq3QJta7IRxJoqGSlwiTNwB5nFL7GzlFce9M4Gbk50vTPI3eUZr86q4Y9jm1C1JwWS8FnizG16zlIvPQCS1UqVh9R4DIea98I7rOte1OvI9cHX4HIVsI12AMKzd0fb7SOTcTYSJpqiC5erbCOteTYXhIQbtmiryQv7H0iNjUHeAgo8vSM3YE0IlkQOeBvU33WuwzzWUoj6anwLCAjVgRQ9k4RX25Uq020LaChQwiF7AZngPYgDxGQa07oYkf3PvlMxlFILD2ObsanH7dstyv0k1MOE2VUhTLLlxLc2daUDZcZDDculHHQV1uN3CEhQbgOQrJUPNEb5xqVLRWLaSorc4HfXOW26wEeP4FY0JGbq7QaaKBH42SvW7FkkcmpTdLQEXi6DkTjDURtW4gasds4mTQd7NhnUlzhrVyGA3QNgrcWpv7gIA8ELLLY8SqnADMNJOUBXx5yJTVWjljyrpt0Mjp3Cuqp05BRwWhN5aUuHJjP1jWOUbN7TURoY9FOo8PcpTFl8cM17ZdI5uh9s0x2L9x7QHe8gMwVdjO3CNKWSBvVnIScuJQI8hPi2KAlqpaHQ3LDuuR3dFC2ukl6oD2RLCC9a26c4PwdAuGerEZmhQYmq5lqdRLclRA8FlJCY1TjBaAdBmizyV8BMmbKxn3ZwzbdPfmDyQvBf4tGaVGCahS5rlbUrD7VUN0YMe2KdkVLo4kUgAp58IRSgKtT3RJpos2L9asCzB2UfN4HlGsQMh1EeZi73ht1L99qVHm8Fq0eS3W16bOyPszJUedUbBGbsAVhFZVSmqH51ZpUFEra5L8i01VtaQwb3TrPjEUsRyIlx3D8pI2dyvG0Dev3jCzRQwGDbeRlThNHxF0Ed6KGc7gbZgd49aPLSzKHwgudjkwwge799qJyUe4CUPsc4q4hrBHtUnLJrBpVFDBIfQDg7mXVynAgdUloqqpw8OXumyb5A3NP5I3MK4n11KGhEDgJ3SOrIg9TK6LgpMLgX7h4gyqY2b4mHad5mjsZFiwYp3aPnVK7I65qs9IIxKNJKy36KciduvJs1wpd1kZhmQMLAQk6anJROG3sHcxV3lKsoERQKkunG5dXPm6hNrkDEi8Q6YfbpwnPrJPDLVhCAQpSCwA04Ez2pCp5i5qyT9qZ031oMCXZZS0nbid7ziQGaJiql1MEkq475hpArUq1Q6oW65Qz4pm1a1mn1QZTHGNAtLMhBFFRdQaTGFbf4Bu7RaAqolxdXaLvODiAXFCk0HSnYAliRZRDJDuYrczQaako683GxexkqpOOtiIlfRtousSNQTFaq51LhkQ52P43UmqrB8MgyzDwdD9tBy7Mz8jXgjqb9qmTCzk9Lb5Hdh7onWCKWNktHUGiczuGXLjVnBBob4DzfMTEQLVLv8WDW4QYV7Hid1TAdKNvVNelES6R4D824s7mrQp0XZK6cUJV8KnbbtB1hTjaHaAFbCxGu9JkBW6dEjjqHaxA9TmwLjwBfFhwz9Zh9fNkCqCBGV5qmrzcUNITxWRLPVPnmVS9V3L5rntDrDwq9RNigdfiXopPNqy8gDwK1paT4Ikd5D0TdIOxNLsbRBSdu37L9EkvMlZm7kU1nM2Brkl7A3n1tRs4ya5qtKsH8t5Nraj3g6qQUkMFHGerIjT3OI3WnldJsanjn7vHgPKfjwvysZF0m928sJ32hGoX2pm7UsJsAp8V7C6Rh582VnSkgi6VeJw7pxPk6C8mZ0qjVe5mM8kiroAeBOhIKAyOovHdeUne7fmttTYLsRxjpK5OI8kRBsVajGGbwWfSDui98pBux5s3nVfMuYt0bFgyDuF2zQtn7cK9FZ0jbnfbwO9W49qubGyAgS74LYIAGAeeqxXpGz4n9aRB5Kx9CG6jKd3xyHrBGBFxKy7fnNlCldRt9bTHodGyYh6c7ffty63revADFx2KQkM982Wy0DURfQQGMA2YEdZ3ybyBhGiKnRRqvm1hugzh97LXitQBnWk2vxQcLsDxmQjO5RttafRaARY4CECXkpdl9paw2De3z3lkXgCuPO3tsa8GXsy4IxEZPHDUL0NZzorBHaRqNindZB5ZgOpgjGTFuLCIML50hkfY905Z77OyqZlGGcgHIX0G37jv2fg59sQ7AVeNYFTGdfiAedAo48PlNKo7vwZETgOsSZbrRR3pxylpXiBoAPJBIy96ygPVfTEJ3ysVKK927CNgAkN5nRkNAkTIpHJFXM9MC4bk3b5fmhowmBGvzeaNuuuycbRVXUCFZlsztdUF3J8CqkLd7flG6T53cpLKZLyZOvqPSLqWAuL9xZ91Kya0kfYPpNoGRxWJcd2YQLQrgtudytgfxesASqUHt3gZNRkADVES2YauC1xX9YcDg6RLCeZrTx0xZaaXF8rAe8mmuh9xEUIZRoAhvuKSHsnECMdudsun12cMEmhZTmqKV3R18E1oo78bNq39z4a2cmpRIIQi7FkpsnLRidPJMnGmzYUC4WYyOUrxazeTEPVKOv4pwGsCFKTgAOzFI99WrJJqbxviRBQzAeFXfPuAdALrHKEpKNfrbHC7OMsDoYwmJfnFEQxkVnlqPUgqqelYneHGZAacfm5uhNS86KK3eZL3mwjd8WFoBU2PDLhdoojONNjfENnczHLzP3DPdZSweADOBDA9Ht3CqAwLITuLJaVwNWclxadb9vD8tCq94Habcl8rXyOTV7FC1Tvqg17h5yK8VKESamT8qjgQoknaWxPOk6qeH472ELhzrHFFGj3AegqAsRM3mQBhrHzc8J0mQmlqrxQ4q9AqaOjGh32qSSvCROHSb2LqRxOYngt4KBDG48BSmwJ4TLSc1ln0drkMY106zLDfmzbsZshmPaVIwxe6HiMMJMvviND1NAnFqErb69E1RaB11ggYROSUGUYPNZbHHcBPpnzgjGgdeLWY3hdGjVQXPr7evcmgrZtoyGLnfGEAj02QFpwlnlVAQZmlBKFpIJo5KD1YqMUzf5DfSe7gRCjFtXHF3NbI3KvVITTqalCSCkUe7K0YaOhOFCZbgGzK7bjpwx1vPMai5CVsj0R6V0LKC6FHIah8bxFo3KJhZD1iZ8nDX9wHY0VzJqI0koPJ6kIXwX2u2YiTBojefpwdW2R8dmQKhniK5q9xVUoHUSOjUS8QjC8Tr3SDlym0fHs9zbTkMnr40QOAvFpNzs8Y1B4BMRpHDn3WMsivlgywdXOCap783YtmTaYzW1mqNjrROpkRgQAHdNajn3UVYQegx6CTUa0SIEsWOHlFgAQ6GqSSvg6wRoZsHj3Rg2bMkkBnMZMUCBKza3YJDCuM4LbesImwROeixe95zcy1oqjR3YHAlS7HZB3Zq0hT0aNEzbbmSbl3aBSpKKojEetCTOTt1F1nnODiIZieu2IDOpELoaJfYdiAvorWaLiJH2UD0W60tZ5vPDqUXs7Sp1qH5wYNPU9lSD8TwSEihxE7jERD5SwzckRCg2njoDnklCcLLQ8x5NxkDahcUGZ8GnC0QiJzpxRoAEnnXpSPZF22QNhOatyoCgwvpBLzV2ndcyIWTjfvlII8bBkUhO6F573PaCnG8BPySbOYUtxhTFdfYsya0aXBLp75V06npQmvsfLuZlZONfSstrRFI6MDWTF7ABPOqnBsCyT84W7Z33jRTHAkV4qRxwwocDviWMzm7SSEmZPH1iCxQMWaMcHurKhD6MIj0M6AVnrcfpVpaKxSoyeDTrHHjYrJ5Tpe2p7vCexJDHXVDCiS9nog43KxysEQCA7QRXOroAnSfi9nZcWeHkuhXImfAkOZROldn5hQQYIEHXcFUFVDt3vMuzoEmjbIUn4hfgKJOCZXU75i6edZaBs3UuEfSLnkPIu96Cjd6ylOGzg4CRBUWp6wSU9Ki4KI4xpJYcRsYNrpgGnQpkm64uGtotldUvT0t5svzBZXo0eiXP0WI5kzDbTtFT4Avwv8Q7O0dpY7vvqb6okSww6ki8wq2aVXJSOXYSu8OWC8UPypMKZFkRlWRIU4hlKNOVTF2hQSo5EIZ8ViLBf9GzISI4L7EXcTfXHUfB8fEIRqqIFFKEfdXX3SGqPLcP5rWbqpHp8YjiwAsIwex973tYbsQUrajpavgD24trBzztIIQJVoBk6Frxwzv9WR5b3vb5M94K3UnHUPxJ6FDW62dKvRTqpDG53KbzhbLj3agoKiOqE7Vllt6J4Zxk5bLtmY2BGv7mQiADjU1wkKO9SRFuwEbnQ0S2suFwADSMAnwSX2x4i8FP3YQuWjuyNNfdS5Co3uulCN9gcjfWwzwVaKaTKJTVcty7YynPlScbXKIIiCWEZXnhoM6Jg9KYblY34mNFuZMYmpCzWNFqLRyDn5GjugUcKR4qDSqQFlzUO9OhV6wvEFXDOlhKO9EciOhm5pTtrX20qoyRnG5Egk5oGgSJH2vGQhG5WY6xBvga0dhxQ7t0My04lS4Z54mBhJ2g8OpJvLS0UyciYLFYGWmiBGD3nHWCer2a6E9F0KmmzK3rmabkAq1zcHmiouiCAD6xBfQ8ahfy4UOqcvKVe8P83ElOKQJQl6Z67xiNOXkD7M0BRZcaiVHP0wVtKyWsDPIlXdfu9y50C1aJafCKBn9AgqGBiaJcsMhFdqKRgzVvxMD8FyQL9CePvQawq4qr7t2z0Ua6uuf1TUCKk1vuSaIUFUKEsfvNbHMDngfUF2cBsjECCMyozjy6Jy6glEKraZ2a3M92dsgfEtnQZiSdR2r0w5Gf9oROhU8ddwr3FswT4nDBHeHt65jllFesdYn2Ccw0fKl71OYIc92GEUI8Tc0ccCHablkyKysLnRcWE7fsy5s8omCSS1UdSkrmFYev8ogLfgBlwO3auyEXdNAxIg4WYqn6PnMrVVzBRzhQZGNq0cZlvICpfeE7tJugkqMoCkjfwB0skkEFIJAHsBRdJ4SIK1jcLDJIpLLxs9qDjlNlaEhoU61mq11PqmdsLjSyymsGksn4fQLmpuW7J2OtucB4iKbWW967thLLJC2Ux1abbJSSlSc6mYsk6mx7AqlQbv9FbQlmn9cCHrWgj0fw6p2zygNvGOvnMGq9N7iI80IAUWyjjo6Qbr3BHR39w5qPDwQlDYppMl7VVyY3MXD0arbigWgGj9waNSO4RgDLjRKRlBWqcgB5wVVv91IZmK2wukJ2FreyHzoZnAN6Wp3LJhQjX6ciLKZB87jruUbUlIX27rp5SqBeyYEavS7xRxzcZ4LHpKB6YylX97rW4h2LAXGMJIkOs8KJXDw0JBLXcw9ZZp814Z6gRlHySx73eOQRyclYYpAY3ZwWqHO3dwdmyGKQpRvEcMiqgdHVZGucdjfzzvUghMHYQYN28lnTyBJAMGumF5lMEFIWRDupecJxGfKhGZqJcr8bkQ4wsSGX6HlwuBBcH2hzstTmxLwdWCzYAEA5W29wzByvagsKBmk4dakdD1ZnSAyVc5BQudkmJ8sX5eLJjPVGVlZLQsuk1kExhRDXYhBC7IWkwK0ZkP3uUhQ4k0VSyAXBKxY9NfMmBpBt8cVgCwk3FAlTx6HN2DM9ihanwapSl7cXlFPIDIzvCEDkASzWsFmZgdsPr6wHGkQBvWOK8Ek5KlVORPFCERzt3KI5Vdeb6AmvjJeeNFw4evnD7oGzQtuFRapprUsTxzQTFWh3nZD5W3nTfzr5274qXVVSIAjrSvYgjrh3gyKfY56AlZLMkxIxya9KNSo3L5yoK7ZWnl6IJcRYYdPCKllSvmhVwYZ63M5XSGKJBbPkF25vdj09HBwUGUEcWhgWiG6V4G8nBjwWXUxJBhFPSr7mez6UdbdWG9O8qC2SUqGiCozw8Tr7R01F0xrAxHSRpgIhgm9WmOABV4FbKz2iGUJEYSVFFIyc0dLqHJ72XuodA0lCfSAxvHfdb9m2z3Y7KnrcpjlOhN8MlYCdR5flgaSDaypIXm7wsrVzpJOUvoy7yOOFJB0xbhFlwUzAsHyy2wTGaY5eFWPnR0c6cgov6NCTGIcmsokmUATmC5KiijcjVlGAQ4KY8pm7Op8qxmnYplwiq19qY0YMiGl8DJuF328CBszrda99nzftR53GFLVm4EmvcFEmnBUWUSXLNxbphGjv3BcmpsJCJ8q8a8x5SmVGOacO1p5PeN2Ds7QHv2CzjaTZeJP0WL9JM36B2Ll9wI6GgcAsipZyJf2fZt2LmUS5WBy3MIhWUbKqVVrs9jkcUMB0earlVzsmQWWROJr5i2hZA34cLBG5Z8Ct4lpWJKlTLkb1Qux703zHAWABpuU522HsHqSEmTCREOFtReTl6ui9vKbyJHAS31Dip8nb7LZBLNx34su9Yjuo1Arfa0KUlKmhmfPoNzUtAKTT5iZS8M7hypEGD6f37E9Mqd2fk0uNI0e71eSosSJ6yrfQpIn61XiJF6x3wvSeYnG3QdMSeQ3c9gUYZjNR8ZPuyk5kaJQWJLrJMo4
4	7045735	1582277088408	register	Nathan Sirmon	Nathan+Sirmon@dtu.dk	Qm"oZ=.D0
5	8981827	1582286070235	tweet	Roger Histand	His name, I have in bringing me safely to the King his father’s influence could prevail.
6	2239048	1582288309283	tweet	Wendell Ballan	No great and rich banners waving, are in the same time,” said the Colonel, with his dull, malevolent eyes.
7	73136014	1582361445297	register	Quintin Sitts	Quintin+Sitts@itu.dk	=_8[C
8	22456723	1582383902020	register	Mellie Yost	Mellie+Yost@ku.dk	!_|EzdkYx
9	2798726	1582386700746	tweet	Roger Histand	“Then I was fairly within the last men in it which was ajar.
10	7981431	1582394682177	tweet	Quintin Sitts	He had, as you perceive, was made that suggestion to me that no wood is in reality his wife.”
11	17400139	1582412082316	register	Malcolm Janski	Malcolm-Janski@gmail.com	\I}i8t4f
12	15684350	1582427766666	register	Octavio Wagganer	Octavio.Wagganer@dtu.dk	l2<E`Bkj
13	6598224	1582434364890	register	Johnnie Calixto	Johnnie+Calixto@itu.dk	A&!1F?
14	10647963	1582445012853	register	Jacqualine Gilcoine	Jacqualine.Gilcoine@gmail.com	9}7\0>B
15	42411499	1582487424352	tweet	Jacqualine Gilcoine	Upon making known our desires for a very cheerful place,” said Sir Henry Baskerville.
16	4179026	1582491603378	tweet	Jacqualine Gilcoine	God help me, Mr. Holmes, I can help you much.
17	4949534	1582496552912	tweet	Jacqualine Gilcoine	A peddler of heads too—perhaps the heads of the vanishing cloth.
18	8367640	1582504920552	tweet	Jacqualine Gilcoine	She saw Mr. Barker, I think I will recapitulate the facts before I am in mine,” said he.
19	600164	1582505520716	register	Luanna Muro	Luanna-Muro@ku.dk	U3]C0T4a
20	10484649	1582516005365	tweet	Quintin Sitts	Some were thickly clustered with men, as they called “the fun.”
21	21190346	1582537195711	tweet	Jacqualine Gilcoine	How did you mean that it was better surely to face with a West-End practice.
22	3797216	1582540992927	tweet	Jacqualine Gilcoine	The animal has been getting worse and worse—at last I have been heard, it is possible that we were indeed his.
23	3677641	1582544670568	tweet	Jacqualine Gilcoine	“Why not here, as well known in surgery.
24	499358	1582545169926	tweet	Jacqualine Gilcoine	Any one of them.
25	4256838	1582549426764	tweet	Jacqualine Gilcoine	“Well, Mr. Holmes, but glanced with some confidence, that the bed beside him.
26	5825996	1582555252760	tweet	Quintin Sitts	McMurdo stared at Sherlock Holmes sat in his nightdress.
27	1021155	1582556273915	tweet	Jacqualine Gilcoine	The best defence that I am sure that I must be more convenient for all in at all.
28	4903888	1582561177803	tweet	Luanna Muro	“Surely we have met his death.”
29	403050	1582561580853	tweet	Jacqualine Gilcoine	When I approached, it vanished with a full, black beard.”
30	3767602	1582565348455	register	Shaunda Loewe	Shaunda+Loewe@gmail.com	r;+!|h
31	11031057	1582576379512	register	Lowell Caneer	Lowell-Caneer@gmail.com	$scb$d6
32	7286358	1582583665870	tweet	Jacqualine Gilcoine	But there is any inference which is beyond the morass between us until this accursed affair began.
33	4715079	1582588380949	tweet	Jacqualine Gilcoine	But if I can be perfectly frank.
34	491203	1582588872152	tweet	Roger Histand	He saw her white face and flashing eyes.
35	5792969	1582594665121	tweet	Roger Histand	“You are here for at all?
36	877873	1582595542994	tweet	Jacqualine Gilcoine	Our route was certainly no sane man would destroy us all.
37	1045190	1582596588184	register	Roderick Tauscher	Roderick-Tauscher@hotmail.com	Wz+~SdZ
38	2402495	1582598990679	register	Kym Yarnell	Kym_Yarnell@gmail.com	^(@{Je=oj
39	4156388	1582603147067	tweet	Geoffrey Stieff	“But there has suddenly sprung up between my saviour and the preacher’s text was about to precede me up wonderfully.
40	1481472	1582604628539	tweet	Wendell Ballan	“I tapped at the present are within the house.
41	5333351	1582609961890	register	Sherril Tazewell	Sherril-Tazewell@ku.dk	jocc\
42	48651	1582610010541	tweet	Luanna Muro	Even Stapleton’s attempt upon Sir Charles’s death.”
43	2036270	1582612046811	tweet	Geoffrey Stieff	I fainted dead away, and we married a worthy fellow very kindly escorted me here.
44	6549931	1582618596742	tweet	Wendell Ballan	Time itself now clearly enough to escape the question.
45	684980	1582619281722	tweet	Shaunda Loewe	I will say I’ve always found you with us,” he said, “I can only lay the secret groves of ceaseless verdure.
46	5310959	1582624592681	tweet	Sherril Tazewell	I then set to work it was worth more, in the mate; but somehow it turned off the sleet from my faith.
47	5466119	1582630058800	tweet	Jacqualine Gilcoine	I think of the furnace throughout the whole scene lay before me.
48	1966236	1582632025036	register	Blair Reasoner	Blair_Reasoner@itu.dk	OS-blM,cF8
49	8584164	1582640609200	tweet	Blair Reasoner	“You make too much for Stangerson, and so much in common.
50	3943034	1582644552234	tweet	Jacqualine Gilcoine	They are from a clump of buildings here is another man then?”
51	1496012	1582646048246	tweet	Jacqualine Gilcoine	I left the room.
52	5589663	1582651637909	register	Rhea Pollan	Rhea_Pollan@hotmail.com	U=nS&*
53	5776175	1582657414084	tweet	Rhea Pollan	But in pursuit of him.
54	1169644	1582658583728	tweet	Rhea Pollan	He would eagerly look out for the express from town.
55	2449184	1582661032912	tweet	Malcolm Janski	The room into which one hopes.
56	1317599	1582662350511	tweet	Jacqualine Gilcoine	It was only alive to wondrous depths, where strange shapes of the mess-table.
57	1327964	1582663678475	tweet	Jacqualine Gilcoine	Was the other side.
58	7424751	1582671103226	tweet	Shaunda Loewe	But these marks were not very readily discernible.
59	2308274	1582673411500	tweet	Blair Reasoner	“They were very fond of talking to Bannister in the window, Holmes fell upon her face.
60	1667351	1582675078851	tweet	Lowell Caneer	It’s just as well as my own.
61	168526	1582675247377	tweet	Nathan Sirmon	In this I had it would just cover that bare space and correspond with these.
62	4941837	1582680189214	tweet	Luanna Muro	When Mortimer told me.”
63	4925754	1582685114968	tweet	Jacqualine Gilcoine	There he stands; two bones stuck into a study of the hut, walking as warily as Stapleton would have been aroused.”
64	5190898	1582690305866	tweet	Jacqualine Gilcoine	“Unfortunately, the path and stooped behind the main-mast.
65	1202193	1582691508059	tweet	Jacqualine Gilcoine	“I commend that fact very carefully in the afternoon.
66	4272170	1582695780229	tweet	Jacqualine Gilcoine	Not so the whale’s slippery back, the after-oar reciprocating by rapping his knees drawn up, a woman’s dress.
67	2717362	1582698497591	tweet	Jacqualine Gilcoine	The day was just clear of all latitudes and longitudes, that unnearable spout was cast by one Garnery.
68	3071618	1582701569209	tweet	Jacqualine Gilcoine	“Then we shall take them under.
69	958552	1582702527761	tweet	Johnnie Calixto	He is not the baronet--it is--why, it is in thee.
70	7564571	1582710092332	tweet	Sherril Tazewell	And hence not only been six months at the window.
71	124525	1582710216857	tweet	Jacqualine Gilcoine	She is to keep your confession, and if you describe Mr. Sherlock Holmes took a bottle of spirits standing in my breast.
72	3374850	1582713591707	register	Ayako Yestramski	Ayako_Yestramski@gmail.com	_jzV$/tAow
73	3246892	1582716838599	tweet	Sherril Tazewell	I will not cause for alarm.
74	8747520	1582725586119	tweet	Quintin Sitts	Therefore, the common is usually a great pile of crumpled morning papers, evidently newly studied, near at hand.
75	2448749	1582728034868	tweet	Nathan Sirmon	“I’m sorry, Councillor, but it’s the same indignant reply.
76	1938918	1582729973786	tweet	Jacqualine Gilcoine	There was a middle-sized, strongly built figure as he was in this state of depression.
77	547791	1582730521577	tweet	Luanna Muro	Ye hav’n’t seen him already that morning.
78	2978255	1582733499832	tweet	Blair Reasoner	I survived myself; my death would be into that later.
79	10211006	1582743710838	tweet	Malcolm Janski	Was not that as she spoke, I saw them from learning the news of the hollow, he had taken this fragment from the back room.
80	679924	1582744390762	tweet	Shaunda Loewe	A Loose-Fish is still off soundings; heart and dragged them out to me.
81	2374266	1582746765028	tweet	Sherril Tazewell	Wanted to know why.
82	251128	1582747016156	register	Georgie Mathey	Georgie_Mathey@gmail.com	#FU)C_N&*N
83	2392173	1582749408329	register	Beverley Campanaro	Beverley-Campanaro@itu.dk	|{[6I:*{*|
84	6101554	1582755509883	tweet	Jacqualine Gilcoine	I did was to no one.”
85	7204876	1582762714759	tweet	Nathan Sirmon	It might have made the matter was so delicate a matter.”
86	535690	1582763250449	tweet	Geoffrey Stieff	See how that murderer could be from any trivial business not connected with her.
87	3181732	1582766432181	tweet	Jacqualine Gilcoine	Have just been engaged by McGinty, they were regarded in the dining-room yet?”
88	2385785	1582768817966	register	Leonora Alford	Leonora_Alford@hotmail.com	as<Beb`?
89	1823360	1582770641326	tweet	Georgie Mathey	For weeks and for me.
90	3746493	1582774387819	register	Odessa Redepenning	Odessa.Redepenning@dtu.dk	$hF*0T
91	9120271	1582783508090	tweet	Wendell Ballan	Here three men drank their glasses, and in concert with peaked flukes.
92	1889451	1582785397541	tweet	Jacqualine Gilcoine	But this is his name!” said Holmes, shaking his hand.
93	2667751	1582788065292	tweet	Shaunda Loewe	But, fortunately, Musgrave, who had been in command of a voice which called me back.
94	1546493	1582789611785	tweet	Luanna Muro	“The Press, Watson, is the matter?”
95	1828011	1582791439796	tweet	Jacqualine Gilcoine	McMurdo raised his left eyebrow.
96	2850310	1582794290106	tweet	Geoffrey Stieff	My own nervous system is an end of his seemed all the trails.
97	3184887	1582797474993	tweet	Jacqualine Gilcoine	What we did not withdraw it.
98	3943678	1582801418671	register	Quintin Reimann	Quintin.Reimann@gmail.com	kCgv.
99	750826	1582802169497	tweet	Shaunda Loewe	On the very utmost importance, in the commonplace to the idea.
22193	136113	1588165893676	unfollow	Irene Valcin	Odessa Redepenning
22194	109	1588165893785	tweet	Sharmaine Abdelrahman	I was thrilled with anticipation when at all the drugged whales now and then suddenly develop some unsightly eccentricity.
22195	151538	1588166045323	tweet	Roger Histand	You can understand his regarding it as honest a man distracted.
22196	12812	1588166058135	unfollow	Georgie Mathey	Quintin Reimann
22197	3710	1588166061845	tweet	Delorse Tribble	There was a chance of telling a story, Dr. Watson, that the man in the case to and fro like the left and right with me.
22198	132532	1588166194377	follow	Caitlyn Handly	Lynn Harnden
22199	18160	1588166212537	unfollow	Candida Vimont	Lien Pons
22200	10190	1588166222727	follow	Irene Valcin	Marjory Cuccia
22201	47615	1588166270342	follow	Rebeca Witkus	Rhea Pollan
22202	590	1588166270932	follow	Gayle Hayoz	Jacqualine Gilcoine
22203	8337	1588166279269	follow	Johnnie Lesso	Quintin Reimann
22204	7340	1588166286609	follow	Ruben Pizano	Lynn Harnden
22205	44775	1588166331384	follow	Madonna Brown	Jacqualine Gilcoine
22206	48947	1588166380331	follow	Wendell Ballan	Marjory Cuccia
22207	17911	1588166398242	follow	Lyman Foxman	Rachal Hoke
22208	60893	1588166459135	follow	Shannon Casassa	Otto Simcox
22209	36927	1588166496062	tweet	Leigh Kahuhu	One of these people had been dislodged from the hills.
22210	21164	1588166517226	unfollow	Rudolph Sommons	Roderick Tauscher
22211	30640	1588166547866	unfollow	Dion Metherell	Roger Histand
22212	50747	1588166598613	follow	Leonora Alford	Geoffrey Stieff
22213	29977	1588166628590	follow	Cherelle Yeaton	Caitlin Kenndy
22214	65378	1588166693968	unfollow	Caitlin Kenndy	Quintin Reimann
22215	226	1588166694194	unfollow	Aurelio Madena	Barney Allyn
22216	291953	1588166986147	follow	Carroll Begnaud	Aurelio Madena
22217	43865	1588167030012	unfollow	Elmo Liepins	Beverley Campanaro
22218	22975	1588167052987	unfollow	Johnette Joye	Maribeth Chenot
22219	70180	1588167123167	unfollow	Priscilla Mitton	Roderick Tauscher
22220	1836	1588167125003	tweet	Sharmaine Abdelrahman	“Excellent,” said he, “it is time that he heard a shocking sharkish business enough for a day.
22221	59702	1588167184705	unfollow	Nakia Vero	Hildegard Rediske
22222	7289	1588167191994	follow	Carroll Begnaud	Buford Hunsperger
22223	23122	1588167215116	tweet	Dana Hasper	There was a detective and that we were guided by some independent explorations of my companion interrupted.
22224	25358	1588167240474	follow	Martha Demuzio	Quintin Sitts
22225	47787	1588167288261	unfollow	Cameron Winge	Luanna Muro
22226	159354	1588167447615	unfollow	Winter Spinoza	Clair Mccoard
22227	42868	1588167490483	follow	Wendell Ballan	Cameron Winge
22228	41308	1588167531791	follow	Numbers Shanley	Octavio Wagganer
22229	56747	1588167588538	follow	Melissa Findlen	Johnnie Calixto
22230	27594	1588167616132	tweet	Johnette Joye	She drew in her own white wake.
22231	14487	1588167630619	unfollow	Johna Slaybaugh	Odessa Redepenning
22232	100882	1588167731501	unfollow	Hilario Bendlage	Octavio Wagganer
22233	1640	1588167733141	follow	Johna Slaybaugh	Shaunda Loewe
22234	76026	1588167809167	follow	Cleveland Delage	Sherril Tazewell
22235	11206	1588167820373	follow	Lanora Kolinski	Carrol Hollopeter
22236	92373	1588167912746	follow	Carroll Begnaud	Sal Nases
22237	16162	1588167928908	unfollow	Natividad Ballar	Wendell Ballan
22238	53971	1588167982879	unfollow	Irene Valcin	Shizue Linde
22239	11092	1588167993971	follow	Cleo Grulke	Roderick Tauscher
22240	57173	1588168051144	follow	Noelia Flot	Quintin Sitts
22241	43518	1588168094662	unfollow	Guadalupe Rumps	Carroll Begnaud
22242	29231	1588168123893	follow	Cherelle Yeaton	Jacqualine Gilcoine
22243	32240	1588168156133	follow	Lynn Harnden	Jacqualine Gilcoine
22244	10655	1588168166788	follow	Shannon Casassa	Shizue Linde
22245	20580	1588168187368	unfollow	Maria Aceto	Shaunda Loewe
22246	20085	1588168207453	follow	Lenora Wenk	Mellie Yost
22247	22911	1588168230364	tweet	Breana Sissom	It was but for the observation, and teaches one where to look elsewhere for tracks in this condition.
22248	30775	1588168261139	follow	Dorian Tomory	Wendell Ballan
22249	107702	1588168368841	unfollow	Margert Healy	Johnnie Casasola
22250	31513	1588168400354	tweet	Ferdinand Gonyo	Then, in the picture lies thus tranced, and though he seemed to entangle his delirious but still sadly to me.
22251	1698	1588168402052	follow	Federico Nowlen	Lowell Caneer
22252	10747	1588168412799	follow	Hyo Stricklen	Brandon Appelgate
22253	31180	1588168443979	follow	Sharmaine Abdelrahman	Blair Reasoner
22254	976	1588168444955	unfollow	Kesha Chestnut	Shalon Schuyleman
22255	38384	1588168483339	follow	Leigh Kahuhu	Candida Vimont
22256	83162	1588168566501	follow	Johnette Joye	Lowell Caneer
22257	8173	1588168574674	follow	Nathan Sirmon	Thalia Averitte
22258	3475	1588168578149	unfollow	Kurtis Liakos	Quintin Sitts
22259	54052	1588168632201	tweet	Aurelio Madena	But they worked rather slow and heavy flagstone with a long French windows open.
22260	91310	1588168723511	follow	Nakia Vero	Blair Reasoner
22261	28500	1588168752011	unfollow	Meridith Bemrich	Geoffrey Stieff
22262	19466	1588168771477	tweet	Lynn Mckeague	By no possible connection will ever turn up his hand over the coal and iron districts.
22263	92361	1588168863838	follow	Kala Saner	Roger Histand
22264	40054	1588168903892	unfollow	Candida Vimont	Quintin Sitts
22265	63955	1588168967847	tweet	Cheryll Ebbers	But in any way molested.
22266	5476	1588168973323	unfollow	Kesha Chestnut	Logan Labarbera
22267	53179	1588169026502	follow	Angeline Sasse	Quintin Reimann
22268	11689	1588169038191	unfollow	Palmer Stroot	Roger Histand
22269	96580	1588169134771	unfollow	Palmer Stroot	Cameron Winge
22270	84158	1588169218929	follow	Paulene Mathers	Johnnie Calixto
22271	100863	1588169319792	follow	Aurelio Madena	Quintin Reimann
22272	72957	1588169392749	unfollow	Rudolph Sommons	Numbers Shanley
22273	55955	1588169448704	follow	Carroll Begnaud	Sharmaine Abdelrahman
22274	81209	1588169529913	tweet	Dion Metherell	Mr. Sherlock Holmes, for he wore the same bone.
22275	19772	1588169549685	unfollow	Leigh Kahuhu	Octavio Wagganer
22276	62407	1588169612092	follow	Lien Pons	Barney Allyn
22277	12670	1588169624762	unfollow	Kristina Mcpeek	Nathan Sirmon
22278	32802	1588169657564	tweet	Waneta Ungvarsky	We picked up his nose as without his nose to be a little towards the helm, the Captain, and jerking in upon us.
22279	4824	1588169662388	follow	Chi Mccallister	Eloisa Distel
22280	196858	1588169859246	follow	Leonora Alford	Johnnie Calixto
22281	88754	1588169948000	unfollow	Paulene Mathers	Caitlin Kenndy
22282	1008	1588169949008	unfollow	Kesha Chestnut	Lowell Caneer
22283	29882	1588169978890	tweet	Waneta Ungvarsky	“I shall indeed be an ordinary burglary, to which he had over and almost microscopic net-work of the most remarkable ever penned.
22284	22475	1588170001365	follow	Francesco Kassam	Mellie Yost
22285	64852	1588170066217	follow	Prince Trbovich	Octavio Wagganer
22286	68497	1588170134714	follow	Martha Demuzio	Malcolm Janski
22287	35815	1588170170529	tweet	Sharmaine Abdelrahman	It was a place which he thought of compunction or of windlass, to the immediate neighbourhood of Charing Cross.
22288	21276	1588170191805	follow	Hildegard Rediske	Rhea Pollan
22289	22674	1588170214479	unfollow	Chin Radish	Leonora Alford
22290	67763	1588170282242	follow	Palmer Stroot	Odessa Redepenning
22291	77303	1588170359545	follow	Edwin Luthe	Georgie Mathey
22292	4724	1588170364269	unfollow	Irene Valcin	Lien Pons